"Paper Title","Paper Link","Publication Year","Publication Type","Publication Title","Author Names","DOI","PDF Link","Open Access","Citations count","Abstract","TL;DR"
"The future of ai in digital marketing trends and predictions for 2025","https://scispace.com/papers/the-future-of-ai-in-digital-marketing-trends-and-predictions-1iaqy56sc03p","2024","Journal Article","International Journal of Artificial Intelligence for Digital Marketing","Hojiakbar Muminov","10.61796/ijaifd.v1i4.185","","No","","The integration of Artificial Intelligence (AI) into digital marketing is reshaping the landscape by offering unprecedented capabilities for personalization, predictive analytics, conversational AI, and content optimization. This article explores the emerging trends and future predictions for AI in digital marketing as we approach 2025. It examines how AI-driven personalization techniques are evolving beyond conventional methods to deliver hyper-personalized consumer experiences, resulting in higher engagement and conversion rates. The study further delves into the advancements in predictive analytics, highlighting its role in forecasting consumer behavior and optimizing marketing strategies in real-time. The rise of conversational AI, particularly chatbots, is analyzed for its impact on customer service and engagement, with a focus on natural language processing (NLP) advancements that enhance customer interactions. The article also addresses the growing use of AI in content creation and optimization, which is set to revolutionize content marketing by enabling scalable, high-quality content production. In addition to technological advancements, the paper critically examines the ethical implications of AI in marketing, including issues related to data privacy, security, and algorithmic bias. By providing a comprehensive overview of these developments, this article offers valuable insights for marketers, business leaders, and researchers looking to navigate the rapidly evolving digital marketing ecosystem. Through a synthesis of academic research, industry reports, and expert opinions, this study presents a nuanced perspective on the future of AI in digital marketing, outlining both the opportunities and challenges that lie ahead","This article explores AI's impact on digital marketing, predicting trends for 2025, including AI-driven personalization, predictive analytics, conversational AI, and content optimization, while addressing ethical implications and technological advancements."
"Trends and Changes in Digital Marketing","https://scispace.com/papers/trends-and-changes-in-digital-marketing-thzfu6py5tt8","2025","Journal Article","","Amitabh Verma","10.2174/9789815305456125010005","","No","","In the chapter titled “Trends and Changes in Digital Marketing,” a detailed examination of the dynamic digital marketing landscape is provided. The focus is on how emerging technologies like artificial intelligence (AI), machine learning, and augmented reality (AR) are revolutionizing marketing strategies. AI is highlighted for its role in personalization and targeting, including customer segmentation and predictive analytics. The use of AI in chatbots and virtual assistants enhances customer interactions, while machine learning improves content recommendation, ad optimization, and fraud detection. AR is noted for creating immersive consumer experiences. The chapter also delves into the transformation of advertising through these technologies, emphasizing dynamic content creation, precision targeting, and automated optimization. Consumer behavior trends are analyzed, noting the increase in mobile usage, e-commerce, social media influence, reliance on online reviews, and demand for personalized experiences. The importance of adapting to these trends through mobile-friendly designs, robust e-commerce platforms, and effective social media strategies is underscored. Additionally, the chapter discusses the growing significance of data privacy, with a focus on regulations like GDPR and CCPA and the need for ethical data use strategies. The chapter acknowledges the rising preference for video and visual content, suggesting strategies for incorporating these elements into digital marketing. Personalized marketing and user-centric experiences are emphasized for their role in enhancing customer relationships, engagement, and loyalty. The chapter concludes by highlighting the need for agility and adaptability in this rapidly evolving field, recommending continuous learning, data-driven decision-making, and agile project management to stay ahead of industry shifts. Overall, the chapter offers a comprehensive overview of current trends in digital marketing, stressing the importance of leveraging emerging technologies, understanding consumer behavior, adhering to data privacy laws, and maintaining flexibility in marketing strategies.","This chapter examines the impact of AI, machine learning, and AR on digital marketing, highlighting trends in personalization, targeting, and consumer behavior, while emphasizing the need for adaptability, data-driven decision-making, and agility in a rapidly evolving field."
"Emerging Scope of Artificial Intelligence (AI) in Marketing","https://scispace.com/papers/emerging-scope-of-artificial-intelligence-ai-in-marketing-5ye61z1dlpqb","2025","Journal Article","International Journal For Multidisciplinary Research","Utpal Chandra Das
Bornali Saikia","10.36948/ijfmr.2025.v07i05.56666","","No","","The integration of artificial intelligence (AI) into marketing represents a paradigm shift, transforming how businesses engage with consumers. This research article delves into the profound changes AL brings to the marketing landscape. At its essence, AI employs sophisticated algorithms and machine learning techniques to process vast amount of data, providing both quantitative and qualitative insights at an unprecedented scale. These capabilities empower marketers to move from intuition-based strategies to data-driven decision-making. One of the most significant impacts of AI in marketing is the ability to deliver highly personalized experiences. Unlike traditional marketing approaches that target broad audiences, AI allows for tailored interactions based on individual consumer preferences, past behaviors and social media activities. This shift towards personalization enhances customer engagement and boosts conversion rates, making once-fictional capabilities a reality in modern marketing strategies. AI also revolutionizes marketing through the automation of both routine and complex tasks. By automating processes such as content scheduling, search engine optimization (SEO) and ad placement management, AI enhances efficiency and accuracy. This automation liberates marketers to concentrate on strategic and creative aspects of their work, areas where human intuition and empathy are indispensable. This paper aims to explore the transformative potential of AI in marketing through comprehensive research finding. This article mainly seeks to highlight the revolutionary impact of AI, demonstrating how it enables unprecedented levels of personalization, efficiency and predictive accuracy in marketing.","This research explores the transformative impact of artificial intelligence (AI) in marketing, enabling personalized experiences, automation of routine tasks, and data-driven decision-making, revolutionizing marketing strategies with unprecedented levels of efficiency and predictive accuracy."
"AI-Powered Predictive Models Transforming the Future of Digital Marketing and Customer Engagement","https://scispace.com/papers/ai-powered-predictive-models-transforming-the-future-of-6k5djd14kaw9","2025","Journal Article","Journal of informatics education and research","CB Bhattacharya","10.52783/jier.v5i1.2015","","No","","A revolutionary chance to improve consumer engagement exists with the incorporation of AI. This proposed delves at the various ways generative AI may be used in digital marketing campaigns, highlighting how it can change the way customers engage and content is made. Personalized content, made possible by AI's capacity to sift through mountains of customer data, is the main emphasis. Chatbots and virtual assistants powered by artificial intelligence are also investigated in the study for their potential to offer real-time assistance and interactivity. By improving the user experience and keeping their attention, this technology encourages more in-depth brand involvement. The article also assesses how well AI-powered social media strategy optimization works. Increased conversion rates, better engagement, and fine-tuned marketing tactics are the results of this automation. Finally, the article takes into account the growing significance of optimizing digital marketing campaigns for voice and visual searches, where artificial intelligence improves content visibility and accessibility through these new search methods. In this proposed to show that generative AI is essential to developing marketing tactics that are more tailored to each individual, creative, and responsive than ever before. Generative AI is a game-changer for digital marketing efforts because it combines creativity, efficiency, and personalization to increase client engagement.","This study explores AI-powered predictive models transforming digital marketing and customer engagement, focusing on personalized content, AI-driven chatbots, and optimized social media strategies to enhance user experience, conversion rates, and marketing efficiency."
"The impact of artificial intelligence on marketing – changes and prospects","https://scispace.com/papers/the-impact-of-artificial-intelligence-on-marketing-changes-3w7l3pw5asdw","2024","Journal Article","Èkonomika i upravlenie: problemy, rešeniâ","Anton V. Semennikov","10.36871/ek.up.p.r.2024.07.05.012","","No","","Artificial intelligence (AI) is fundamentally changing the field of marketing, offering innovative solutions for process automation, personalization of customer interaction and data analysis. This article examines the changes caused by the introduction of AI in marketing, including the automation of marketing campaigns, social media management and content creation. Particular attention is paid to the prospects of using AI, such as the development of chatbots, virtual assistants and new advertising opportunities. The social and ethical aspects related to data privacy and targeting ethics are also discussed. In conclusion, conclusions are drawn about the importance of AI for marketing and recommendations are offered for further research and practical application.","This article examines the impact of artificial intelligence on marketing, highlighting changes in automation, personalization, and data analysis, as well as prospects for chatbots, virtual assistants, and new advertising opportunities, while discussing social and ethical implications."
"Artificial Intelligence and Its Impact on Digital Transformation Processes","https://scispace.com/papers/artificial-intelligence-and-its-impact-on-digital-g7dq01eniw","2024","Book Chapter","","Nelson Salgado-Reyes
Damián Nicolalde-Rodriguez
Jaime Meza
Mónica Elva Vaca-Cárdenas","10.1007/978-981-99-8894-5_4","","No","","Artificial intelligence (AI) and digital transformation are two closely related concepts that are changing the way businesses and organizations operate and compete in today's marketplace. AI, which refers to the ability of machines to perform tasks that require human intelligence, is being increasingly used in digital transformation, which refers to the process of adapting organizations to new digital technologies to improve their efficiency and profitability. Thus, AI in digital transformation presents numerous opportunities for companies, including improvements in operational efficiency, process optimization, product and service customization, and more informed decision-making. Though, it also poses significant challenges, such as the need to reorganize and redesign business processes to take full advantage of AI capabilities, and the need to ensure data privacy and security. The systematic review of the current literature suggests that the adoption of AI in digital transformation is increasing in different sectors and business areas, and that companies that manage to effectively integrate AI into their processes and operations are gaining significant competitive advantages. However, it also highlights the importance of addressing ethical and regulatory challenges associated with AI, and fostering education and skills development in the workforce to ensure an effective transition to an AI-driven digital economy.","AI and digital transformation are changing the way businesses operate and compete. AI is being increasingly used in digital transformation, presenting opportunities for operational efficiency, process optimization, product customization, and informed decision-making. However, challenges such as process redesign and data privacy need to be addressed. The adoption of AI in digital transformation is increasing in different sectors and business areas, and companies that effectively integrate AI into their processes are gaining significant competitive advantages."
"Evaluating The Integration Of Ai In Digital Marketing Automation","https://scispace.com/papers/evaluating-the-integration-of-ai-in-digital-marketing-6wq83xpgugq2","2024","Journal Article","African Journal of Biomedical Research","Prof. Rahul Ahuja","10.53555/ajbr.v27i4s.5665","","No","","The integration of artificial intelligence (AI) within digital marketing automation systems has proven to be a successful model across the globe. This revolutionary integration has completely changed the landscape of branding, advertising, customer connect, marketing strategies and business operations. This research paper evaluates the integration and profound impact of Artificial Intelligence (AI) and Digital Marketing Automation processes, including but not limited to personalized targeted advertising, content delivery, predictive analytics, customer engagement, support, and retention. The researcher has followed a comprehensive evaluation process by analysing the utilization, effectiveness, challenges, and prospects of AI-driven marketing automation solution that enhances marketing efficiency, increases customer satisfaction, and achieves business objectives for all types of businesses. Several real-world case studies and industry trends, research papers, and key insights were studied to elucidate the role of Artificial Intelligence in automating and optimizing digital marketing processes, improving customer experiences, and driving overall business performance. This research paper contributes to a deeper understanding of how AI is reshaping the digital marketing landscape and offers valuable insights for businesses, marketers, researchers, and other industry experts navigating this dynamic domain. &nbsp","This research evaluates the integration of AI in digital marketing automation, its impact on branding, advertising, and customer engagement, and its effectiveness in enhancing marketing efficiency, customer satisfaction, and business objectives."
"Machine Learning and Artificial Intelligence-Based Tools in Digital Marketing: An Integrated Approach","https://scispace.com/papers/machine-learning-and-artificial-intelligence-based-tools-in-1oz2iiwf","2022","Book Chapter","","","10.4324/9781003206316-8","","No","","Technological growth and advancement have created a lot of opportunities for companies in the field of marketing and digital marketing (DM). The use of analytical tools creates a competitive advantage for companies in the market. By the use of artificial intelligence (AI) and machine learning (ML), it becomes easy to forecast or predict the future and support the management in taking important decisions. All these insights are gained from the available research data and big data, especially in the case of DM. Research has revealed the level of awareness of managers on ML and how they use AI- and ML-based tools to make strategic decisions and support their marketing activities. The findings of this research clearly highlight (i) the perceptions of the management about analysis tools, (ii) the awareness among managers/top management on various terms related to AI and ML, (iii) the tools used by managers (based on AI and ML) and how to adopt ML in DM, (iv) the role of AI- and ML-based analytical tools in decision-making and setting digital marketing strategies.","In this article , the authors reveal the level of awareness of managers on ML and how they use AI- and ML-based tools to make strategic decisions and support their marketing activities."
"Artificial Intelligence (AI): Revolutionizing Digital Marketing:","https://scispace.com/papers/artificial-intelligence-ai-revolutionizing-digital-marketing-u45drjihka","2021","Journal Article","Australasian Marketing Journal (amj)","Patrick van Esch
J. Stewart Black","10.1177/18393349211037684","","No","","Artificial intelligence (AI)-enabled digital marketing is revolutionizing the way organizations create content for campaigns, generate leads, reduce customer acquisition costs, manage customer expe...","Artificial intelligence (AI)-enabled digital marketing is revolutionizing the way organizations create content for campaigns, generate leads, reduce customer acquisition costs, manage customer expe...."
"Impact of AI in Personalized Digital Marketing: Boosting Customer Engagement through Tailored Content","https://scispace.com/papers/impact-of-ai-in-personalized-digital-marketing-boosting-7pfcq0y7rswc","2024","Journal Article","Journal of Communication and Management","D Pushpa Gowri","10.58966/jcm2024334","","No","","The revolution in digital marketing has boomed the development of artificial intelligence in personalizing customized content for every user. This conceptual research highlights the impact of AI in enhancing customer engagement which can be accomplished with tailored content. Marketers gain a deep understanding of individual customer’s needs and preferences by studying the huge data with the help of machine learning, natural language processing and predictive analytics. Businesses use this knowledge to engage with customers personally to boost their involvement, creating strong brand loyalty. This study examines the AI-driven personalisation techniques in different digital marketing disciplines, which also follows the customer engagement benchmark. It also emphasizes the AI’s capacity to transform digital marketing strategies and provide a platform for business to captivate their customers in remarkable ways creating lasting impressions.","This study examines AI-driven personalization techniques in digital marketing, enhancing customer engagement through tailored content, leveraging machine learning, natural language processing, and predictive analytics to boost brand loyalty and customer involvement."
"Organizational and Technological Barriers to AI-Driven Marketing Strategies in FMCG: Implications for Campaign Performance Enhancement","https://scispace.com/papers/organizational-and-technological-barriers-to-ai-driven-bq1fj26d9r1o","2025","Journal Article","","Yana Kolesnik","10.20944/preprints202506.2425.v1","","No","","This study explores the organizational and technological barriers that hinder the effective integration of AI-driven marketing strategies in the FMCG sector, with a particular focus on social media campaigns. Drawing on a mixed-methods approach—including 20 expert interviews and a survey of 372 marketing professionals—the research examines how these barriers influence key performance indicators such as reach and engagement, while accounting for differences in company size. The findings highlight that AI-driven content personalization significantly enhances marketing outcomes, yet its effectiveness is constrained by persistent challenges including poor data quality, lack of algorithmic transparency, bias in audience segmentation, and limited real-time adaptability. In addition to these technological obstacles, the study identifies organizational-level barriers, such as insufficient internal capabilities, delayed model updates, and a lack of proactive AI system tuning, which collectively reduce campaign agility and responsiveness. Key recommendations emphasize the need for AI-human collaboration, real-time data integration, and explainable AI frameworks to support trust and performance optimization. The study offers both theoretical contributions and actionable insights for marketing professionals, emphasizing that successful AI deployment requires not only advanced tools, but also supportive organizational structures and continuous adaptation.","This study identifies organizational and technological barriers hindering AI-driven marketing strategies in FMCG, highlighting the need for AI-human collaboration, real-time data integration, and explainable AI frameworks to enhance campaign performance and overcome challenges in social media campaigns."
"An In-Depth Analysis of How Artificial Intelligence Is Being Used in the Field of Digital Marketing","https://scispace.com/papers/an-in-depth-analysis-of-how-artificial-intelligence-is-being-61hx5zebtnvw","2024","Journal Article","Advances in marketing, customer relationship management, and e-services book series","Minh Tung Tran","10.4018/979-8-3693-4361-6.ch001","","No","","This thorough examination delves into the ways in which Artificial Intelligence (AI) is transforming the landscape of online advertising. AI plays a role in tailoring ads to individual preferences, generating dynamic content, and utilizing chatbots to enhance customer interaction. Through the use of data and automation, AI optimizes advertising campaigns and enhances overall efficiency. However, it is important to consider the ethical implications of AI. The study emphasizes the need to closely monitor potential biases in algorithms and anticipate job displacement due to automation. To harness the full potential of AI, the study provides practical advice to marketers. This comprehensive analysis highlights AI as a powerful catalyst for change in online advertising, urging stakeholders to navigate its potential and challenges in order to build a successful future.","This study examines AI's transformative impact on digital marketing, highlighting its role in personalized ads, dynamic content, and chatbots, while emphasizing the need to monitor biases and job displacement, and providing practical advice for marketers to harness AI's potential."
"Artificial intelligence and digital marketing: an overview","https://scispace.com/papers/artificial-intelligence-and-digital-marketing-an-overview-qc5n43czhx","2024","Journal Article","International journal of engineering science & humanities","Mrs. Santosh","10.62904/f9zwxv22","","No","","Artificial intelligence (AI) has come to improve digital marketing. With the help of AI, marketers can produce better products, make delivery faster, attract customers more effectively, and understand customer behavior. The company is using AI in marketing to create a more personalized experience across all channels. It will help marketers to better understand their audience interaction with their brand and better understand how their audience interacts with it and how they can attach to it. To create a balance between using AI and remaining transparent with customers, as more companies are funding AI-based products, customers want more transparency around how these technologies work—and what they mean for privacy. AI can be used in many ways, from improving website navigation to using computer vision to build more targeted ads. With the help of AI, many digital marketing tools are being used by marketers in daily transactions. It can help them in many ways, like social media management, graphic design, content creation, and research. It can also help them to provide better services to their customers. Without any human intervention, AI might be able to give a simple question’s answer about a company's products or services. With the help of AI, marketers' lives can be easier in the future by automating much of their present activity and providing information about consumers. In this study, conceptual methodology is used as the basis to collect secondary data and achieve the study objectives.","AI is improving digital marketing by creating a more personalized experience across all channels, improving customer understanding, and automating marketing tasks."
