"Paper Title","Paper Link","Publication Year","Publication Type","Publication Title","Author Names","DOI","PDF Link","Open Access","Citations count","Abstract","TL;DR"
"Artificial Intelligence for Analysing Consumer Buying Behaviour Towards Digital Marketing of Electronic Gadgets","https://scispace.com/papers/artificial-intelligence-for-analysing-consumer-buying-3z9tfsctoa","2024","Journal Article","","Mrs.R. Sathiya*
P.A. Padmaavathy","10.1109/icict60155.2024.10544754","","No","","The evolution of digital marketing is intertwined with advancements in technology, particularly Artificial Intelligence (AI). Businesses increasingly rely on AI technology and virtual assistants to gain real-time consumer insights and deliver exceptional customer service. This review examines English-language research publications on AI and digital marketing, highlighting their pivotal role in shaping the market environment. The findings highlight the dynamic nature of technology and its thoughtful impact on the digital market. The research analysis emphasized that AI will find numerous applications in the future, benefiting not only digital marketing but also other industries. Technologies have significantly influenced the digital market landscape by offering advantages such as efficiency, affordability, and time savings. By leveraging AI's predictive capabilities, companies can more effectively target consumers, develop campaigns with higher conversion rates, and enhance customer satisfaction. The increasing integration of AI across industries will revolutionize business operations, particularly in the marketing of electronic devices, where AI applications are optimizing the targeting techniques and enhancing the overall marketing effectiveness.","AI plays a pivotal role in shaping the digital marketing landscape, offering efficiency, affordability, and time savings. It revolutionizes the targeting techniques and enhances the overall marketing effectiveness in the electronic gadgets industry."
"Revolutionizing In-House Digital Marketing with End-to-End Marketing Automation Powered by AI and SaaS","https://scispace.com/papers/revolutionizing-in-house-digital-marketing-with-end-to-end-11bqjpa163ko","2024","Journal Article","","Praveen Gujar
Gunjan Paliwal
Sriram Panyam","10.1109/colcom62950.2024.10720305","","No","","The integration of end-to-end marketing automation powered by AI and SaaS has the potential to revolutionize in-house digital marketing. This article explores how these technologies enhance operational efficiency, targeting, and data-driven decision-making. AI and SaaS enable streamlined workflows, personalized customer interactions, and optimized marketing strategies, significantly improving ROI. The article outlines the key components of marketing automation, the transformative role of AI, and the advantages of SaaS, providing a comprehensive guide for businesses to leverage these technologies. As the digital marketing landscape evolves, adopting AI and SaaS-driven automation is essential for maintaining a competitive edge and achieving long-term success.","This article explores how AI and SaaS-powered marketing automation revolutionizes in-house digital marketing by enhancing efficiency, targeting, and data-driven decision-making, significantly improving ROI and providing a comprehensive guide for businesses to leverage these technologies."
"Inteligência artificial: uma nova era para o marketing digital","https://scispace.com/papers/inteligencia-artificial-uma-nova-era-para-o-marketing-uiix7jg4bc","2024","Book Chapter","","Wanderson Taylon dos Santos Ferreira
Edilson Carlos Silva Lima
Leonardo de Castro Mesquita","10.29327/5391074.1-8","","No","","O marketing digital é uma estratégia essencial para empresas de todos os tamanhos. No entanto, o cenário atual, com o excesso de informações e a crescente concorrência, torna cada vez mais difícil alcançar o público-alvo e obter resultados positivos. Neste artigo, destacamos a importância da inteligência artificial (IA) para o marketing digital. A IA pode ser usada para resolver diversos problemas relacionados a esse campo. Apresentamos também algumas ferramentas e métodos que podem ser usados para implementar a IA no marketing digital. Essas ferramentas e métodos podem ser utilizados por empresas de todos os tamanhos, independentemente do orçamento ou do nível de conhecimento técnico. Palavras-chave: marketing digital, inteligência artificial, segmentação de público, personalização de conteúdo, automatização de tarefas.","A IA é essencial para o marketing digital, ajudando a resolver diversos problemas e a obter resultados positivos."
"Leveraging Artificial Intelligence for Digital Marketing: Insights from SHEIN for VMS Industry","https://scispace.com/papers/leveraging-artificial-intelligence-for-digital-marketing-5enwfowdooca","2024","Journal Article","Dirassat Journal Economic Issue (DJEI)","Sonia Kherbachi
Naima Benkhider
Nassim Keddari","10.34118/djei.v15i2.3908","","No","","In the current global landscape, where technology-driven data penetration is the hardcore of digital marketing, Artificial Intelligence has gained paramount importance. This paper explores artificial intelligence applied to digital marketing practices through associated technologies. Through qualitative and quantitative approaches, we aim to propose research directions addressing AI challenges firms encounter in marketing. A qualitative interview with VMS Industry’s marketing manager and a quantitative analysis of Hugging Face’s implementation in SHEIN’s marketing activities were conducted. The results have revealed that using Artificial Intelligence fundamentally redefines how firms’ approach and succeed in their digital marketing practices. SHEIN’s experience in integrating artificial intelligence into its marketing practices could be an emerging solution for gaining visibility on the web. For the VMS Industry, the results have confirmed that Artificial Intelligence’s selective and targeted use in personalizing interactions with customers and creating visual and textual content is optimized.","This study explores AI's impact on digital marketing, leveraging SHEIN's experience to propose research directions addressing AI challenges in marketing, revealing AI's potential to redefine digital marketing practices and enhance customer interactions in the VMS Industry."
"Unlocking the Power of Artificial Intelligence and Machine Learning in Transforming Marketing as We Know It","https://scispace.com/papers/unlocking-the-power-of-artificial-intelligence-and-machine-4p48mm6nht","2023","Book Chapter","Advances in business information systems and analytics book series","Thangaraja Arumugam
R Arun
Sundarapandiyan Natarajan
Kiran Kumar Thoti
P. Shanthi
Uday Kiran Kommuri","10.4018/979-8-3693-0049-7.ch005","","No","","Technological changes have helped the methodology of execution where we can examine the sector in addition to the manner enterprise is carried out. Productive development has facilitated correct manufacturing in large volumes. The advanced technology, together with information in analytics, smart devices, computerization, and artificial intelligence (AI), is converting the system of society and persons to interact on a basic level. The evolution and development of artificial intelligence (AI) have transformed the effectiveness of commercial enterprises globally. However, business adoption of AI-based total packages by businesses remains constrained because of a lack of know-how approximately the generation. The technology can assist the organisation in understanding the clients and permit it to target the customers better and personalize advertising and marketing movements and messages. Advertising takes the benefit of facts to big data: consumer needs research, marketplace analyses, client insights, and competition intelligence.","AI and ML are transforming marketing, enabling businesses to understand customers better, personalize advertising, and target customers more effectively."
"AI-Driven Marketing Strategies: Unlocking Growth Potential and Operational Efficiency in the Digital Communication Landscape","https://scispace.com/papers/ai-driven-marketing-strategies-unlocking-growth-potential-2ixct31gedfj","2024","Journal Article","","Farah Mohamad Farouk Saboune","10.1109/iccns62192.2024.10776195","","No","","Customer satisfaction and loyalty are crucial factors for corporate success. Artificial Intelligence (AI) enhances the user experience in e-commerce by addressing client needs. AI-powered computers can create virtual assistants to assist users with their shopping, chatbots to provide up-to-date product information, efficient networks to direct customers to the right person, and engage with users to build a loyal client base. AI in digital marketing helps organizations gain trust while expanding their market share. In recent years, industries worldwide have shown a willingness to leverage the benefits of employing Artificial Intelligence (AI) in digital marketing. However, implementing AI in digital marketing can be costly and time-consuming. Marketers need to carefully consider the costs and resources required for training and maintaining AI systems, as well as the potential benefits and return on investment (ROI). This paper aims to address financial and operational issues, including upfront costs, data processing, integration with existing systems, maintenance and updates, and the personnel required for implementing AI in Digital Marketing. Implementing AI technology can necessitate a significant upfront investment, including the cost of software licenses, hardware upgrades, and personnel training. This paper will discuss the costs and resources necessary for implementing AI in Digital Marketing.","This paper explores the benefits and challenges of implementing AI-driven marketing strategies, highlighting the need for careful consideration of costs, resources, and ROI to unlock growth potential and operational efficiency in digital communication."
"ai’s role in marketing for smes: knowledge, barriers and application potentials","https://scispace.com/papers/ais-role-in-marketing-for-smes-knowledge-barriers-and-216o9ymugd","2024","Proceedings Article","","Michelle Weber
Eylem Bulut
Laura Bies
Tobias Greff
Dirk Werth","10.1109/acdsa59508.2024.10467979","","No","","We investigate how small and medium-sized enterprises (SMEs) perceive and apply Artificial Intelligence (AI) in marketing. Studies in the field of AI currently focus on AI in business areas outside of marketing. Due to the increasing economic importance of AI in marketing, we address relevant influencing factors for AI use, potential AI applications in marketing, and the obstacles and opportunities associated with the use of this technology. Investigating this topic is particularly relevant for SMEs which lack resources and rely on cost reductions and prospective revenues through AI. This study consists of an online survey targeting marketing professionals in SMEs. The results show a strong interest among SMEs in adopting AI for marketing, but a significant gap exists between interest and actual implementation. Key challenges to its application include a lack of AI knowledge, a shortage of specialists, and inadequate data infrastructure. Our results show that, despite these challenges, marketing professionals see AI as a valuable tool for gaining consumer insights and enhancing performance management. Through this study we emphasize the importance of internal training, collaborative projects, and the formation of specialized AI teams to bridge the theoretical and practical application gap.","AI holds significant potential for SMEs in marketing, but implementation challenges exist due to lack of knowledge, specialists and inadequate data infrastructure. Despite challenges, AI holds promise for gaining consumer insights and enhancing performance management."
"Strategic Adoption of Emerging Marketing Technologies","https://scispace.com/papers/strategic-adoption-of-emerging-marketing-technologies-ouyao3f4fhbj","2025","Journal Article","Advances in computational intelligence and robotics book series","","10.4018/979-8-3373-2518-7.ch004","","No","","This chapter examines the strategic integration of artificial intelligence in marketing by urging practitioners to balance enthusiasm with analytical rigor and to approach technology adoption through clearly defined objectives and evidence-based decision-making. Marketers are encouraged to avoid the pervasive AI hype by carefully identifying tools and use cases that deliver tangible value, rather than succumbing to trends that promise transformation without substantive returns. This chapter stresses the importance of answering the “for what end” question by establishing specific, measurable goals that align AI capabilities with broader marketing strategies, ensuring that digital initiatives are purpose-driven rather than technology-driven. Drawing parallels to the 1990s website boom, it illustrates how early adopters who failed to develop coherent strategies ultimately encountered market saturation and diminished returns, while those who aligned digital innovation with clear business objectives achieved sustainable growth.","This chapter advocates for strategic AI adoption in marketing, urging practitioners to balance enthusiasm with analytical rigor, set clear objectives, and prioritize evidence-based decision-making to avoid hype and ensure tangible value from emerging technologies."
"Exploring the role of AI in shaping future marketing strategies: evaluations and outlooks","https://scispace.com/papers/exploring-the-role-of-ai-in-shaping-future-marketing-2s2zcg430ssh","2024","Journal Article","Revista Amazonía investiga","Natalia Bobro
Roman Hyshchuk
Артур Струнгар
Oleksandr Bukovskyi
Vitalii Alekseiko","10.34069/ai/2024.80.08.4","","No","","In the contemporary era, the advent of artificial intelligence (AI) is precipitating profound shifts in numerous sectors, mainly marketing, where personalisation and decision-making are undergoing radical transformations due to novel technologies. This study aims to examine the opportunities and challenges associated with the integration of AI into marketing strategies. The research revealed AI's impact on personalising marketing content, enabling companies to foster more profound consumer interactions. The study then examined AI's role in decision-making, where using sophisticated analytical tools leads to more justified and effective strategies. The article's conclusions indicate that AI has the potential to enhance the effectiveness of marketing campaigns, mainly through the personalisation of consumer interactions and the optimisation of marketing operations. The research provides a framework for further scientific investigation in this field, focusing on developing effective regulations and standards that will enable the realisation of AI's potential in marketing while minimising the risk of adverse effects.","This study examines AI's impact on marketing strategies, revealing its potential to personalize content, enhance decision-making, and optimize operations, while highlighting the need for effective regulations to mitigate risks and maximize benefits in the marketing sector."
"Abridging the Digital Marketing Gap","https://scispace.com/papers/abridging-the-digital-marketing-gap-39d87bej","2023","Journal Article","Advances in marketing, customer relationship management, and e-services book series","Chin Wei Lai","10.4018/978-1-6684-8166-0.ch010","","No","","The COVID-19 issue has, albeit at varied rates, pushed digital transformation in industry and services across the majority of nations. Achieving the objectives on the path to excellence depends on the delivery of customized goods or services and changing consumer needs. Digital marketing can aid in expanding customer reach internationally and strengthening client relationships. While data-driven decision-making reduces risk, technology can help marketers deliver customers more of what they want and need. Artificial intelligence (AI), the internet of things (IoT), remote collaboration, cloud computing, blockchain, and data analytics are among the technologies that are rapidly transforming the way that digital marketers do business and develop strategies leading to global economic growth. This book chapter explores the potential of AI and IoT in digital marketing. It also provides information on the impact of new technologies on digital marketing and the top trends in this field.","In this article , the authors explore the potential of AI and IoT in digital marketing and provide information on the impact of new technologies on digital marketing, and the top trends in this field."
"The Future of Digital Marketing: How Would Artificial Intelligence Change the Directions?","https://scispace.com/papers/the-future-of-digital-marketing-how-would-artificial-2vhl6r2xm4","2023","Book Chapter","Disruptive Technologies and Digital Transformations for Society 5.0","Khan Md. Raziuddin Taufique
Md. Mahiuddin Sabbir","10.1007/978-981-99-5354-7_9","","No","","Technological advancements have made the most disruptive change in marketing and consumer behavior in the last few decades. The history of change suggests that technology has entirely transformed the media from cable TV to more personalized technologies. In particular, the Internet and other relevant information technologies and platforms such as social media, powerful search engine, big data, mobile apps, and augmented reality are redefining marketing theories and practices. These advancements, on the one hand, have enabled marketers to enhance customer relationship and engagement. On the other hand, customers are becoming more powerful than sellers in creating and controlling the information content. Artificial intelligence (AI), the use of computerized programs and machinery that exhibit human intelligence, is expected to have even much greater impact on marketing and customer behavior than social media and other recent advancements. Applying a desk research method, the primary purpose of this chapter is to highlight the present state of the application of AI in marketing with a focus on digital marketing. The chapter also aims to identify the future directions of digital marketing with AI as a potential major driver. The major hotspots identified for future research include future marketing jobs and relevant skills, change in consumer decision making, AI-driven social media marketing and new product development, enhanced recommender engine, and augmented reality marketing. Practically, the findings will help marketers better prepare for designing marketing strategies for ever-emerging and more empowered digital consumers.","The future of digital marketing is poised to be revolutionized by AI, which will significantly impact customer behavior and marketing strategies. AI is expected to drive major changes in various aspects of digital marketing, including consumer decision making, social media marketing, product development, and augmented reality marketing."
"AI and Blockchain-Driven Digital Marketing","https://scispace.com/papers/ai-and-blockchain-driven-digital-marketing-3ds2hhmxn93v","2025","Journal Article","Advances in computational intelligence and robotics book series","Apoorva Verma
Cristina Ciliberto
Leena Bhatia","10.4018/979-8-3373-3897-2.ch011","","No","","In the digital age, Artificial Intelligence and Blockchain are transforming marketing by establishing new benchmarks in trust, personalization, data security, and efficiency, critical for businesses in today's competitive landscape. While traditional marketing struggles to meet consumers' demands for meaningful interactions in the experience economy, AI and Blockchain are revolutionizing digital marketing approaches. This empirical study uses Power BI to analyze 100 marketing campaigns across six industries, evaluating these technologies' impact on ROI, conversion rates, CTR, and sales. Results show AI-powered campaigns achieve 4.8% average CTR and 19% higher conversion rates than traditional campaigns, significantly enhancing customer engagement and sales. Blockchain-driven strategies build trust and consistency, increasing overall ROI by 23%, particularly in Real Estate and Finance. The research reveals industry-specific patterns: Finance and Retail benefit most from AI implementation, while Blockchain demonstrates stronger customer retention capabilities in Real Estate.","This study examines the impact of AI and Blockchain on digital marketing, revealing AI-powered campaigns achieve 4.8% CTR and 19% higher conversion rates, while Blockchain-driven strategies increase ROI by 23%, particularly in Real Estate and Finance."
"Utilizing Artificial Intelligence in Digital Marketing Management to Optimize Online Sales","https://scispace.com/papers/utilizing-artificial-intelligence-in-digital-marketing-o66eanjem14e","2025","Journal Article","","Mersiana Setiarini
Senny Handayani Suarsa","10.71364/rhdp1x92","","No","","In the era of digital transformation, artificial intelligence (AI) has become a strategic enabler in digital marketing management, particularly for optimizing online sales performance. This study explores the roles of key AI functionalities—predictive analytics, conversational AI, and personalization engines—across different stages of the digital marketing funnel. The research is motivated by the growing importance of AI in enhancing customer engagement, targeting precision, and conversion optimization, while also recognizing the challenges firms face in adoption, including resource constraints, ethical concerns, and regulatory issues. The study employed a qualitative literature review, systematically analyzing and synthesizing findings from academic journals, books, industry reports, and empirical case studies published within the last five years. The analysis shows that predictive analytics significantly improves targeting efficiency and click-through rates at the awareness stage, conversational AI enhances engagement and conversion by delivering responsive and personalized interactions, and personalization engines optimize purchase decisions by increasing conversion rates and average order value (AOV). Findings also highlight that AI tools are most effective when integrated into a holistic framework, rather than applied in isolation. The research offers a conceptual model linking AI tools to measurable sales performance metrics and provides implementation guidelines tailored to different organizational contexts, including large enterprises, SMEs, and firms in emerging markets. By integrating AI into digital marketing strategies, firms can achieve not only operational efficiency but also sustainable competitive advantage.","This study explores AI's role in digital marketing management, analyzing predictive analytics, conversational AI, and personalization engines' impact on online sales performance, highlighting their effectiveness when integrated into a holistic framework."
