"Paper Title","Paper Link","Publication Year","Publication Type","Publication Title","Author Names","DOI","PDF Link","Open Access","Citations count","Abstract","TL;DR"
"Integration of Artificial Intelligence in Digital Marketing Strategies Based on Business Data Analytics","https://scispace.com/papers/integration-of-artificial-intelligence-in-digital-marketing-vrvq4rdiehb7","2025","Journal Article","ADI Bisnis Digital Interdisiplin","Qurotul Aini
Sutama Wisnu Dyatmika
Mochamad Heru Riza Chakim
Miftakhul Khasanah
Zabenaso Queen","10.34306/abdi.v6i1.1230","","No","","The digital transformation in the era of Artificial Intelligence (AI) has revolutionized marketing practices by placing data analysis at the core of adaptive and precision-based strategies. This study aims to analyze how the integration of AI and business data analytics can strategically and sustainably enhance the effectiveness of digital marketing. The research method employs a qualitative approach through literature review and case analysis of AI implementation in digital business contexts. The findings indicate that the use of AI in market segmentation, consumer behavior prediction, and content personalization significantly improves conversion rates, customer loyalty, and marketing cost efficiency. Moreover, this technological integration also supports the achievement of the Sustainable Development Goals (SDGs), particularly Goal 8 (decent work and economic growth) and Goal 9 (industry, innovation, and infrastructure). These findings highlight the importance of strengthening digital capabilities through the adoption of AI-based technology and data analytics as a foundation for building responsive, innovative, and sustainable marketing strategies aligned with the demands of the digital economy.","This study integrates AI and business data analytics to enhance digital marketing effectiveness, improving conversion rates, customer loyalty, and cost efficiency, while supporting Sustainable Development Goals 8 and 9 through responsive, innovative, and sustainable marketing strategies."
"Comparative Study of Artificial Intelligence (AI) Utilization in Digital Marketing Strategies Between Developed and Developing Countries: A Systematic Literature Review","https://scispace.com/papers/comparative-study-of-artificial-intelligence-ai-utilization-1ydsckviiokm","2024","Journal Article","Ilomata International Journal of Management","Muhammad Umam Mubarok
Maheni Ika Sari
Yohanes Gunawan Wibowo
Roshan Mathew","10.61194/ijjm.v6i1.1534","","No","","Artificial Intelligence (AI) has become crucial in digital marketing strategies in the rapidly advancing digital era. Developed and developing countries exhibit significant differences in adopting and implementing this technology, influenced by infrastructure readiness, human resources, and policy support. This study aims to compare the use of AI in digital marketing strategies between developed and developing countries to understand each group's challenges and opportunities. The research employs a Systematic Literature Review (SLR) method by analyzing 50 articles from leading databases such as Scopus, Springer, and IEEE Xplore. The analyzed articles were selected based on inclusion criteria, including relevance to the topic, publication year (2018-2024), and full accessibility. Data were analyzed through thematic synthesis to identify patterns, trends, and gaps in AI adoption between the two groups of countries. NVivo and VOSviewer are used as analytical tools to facilitate data analysis. The findings reveal that developed countries leverage AI for content personalization, predictive analytics, and marketing automation, supported by advanced digital infrastructure. Meanwhile, developing countries still face various obstacles, such as limited infrastructure and digital literacy. The implications of this study highlight the need for more significant investment in technological infrastructure in developing countries and the importance of global collaboration to accelerate equitable AI adoption. This research also provides recommendations for policymakers and business practitioners to optimize AI utilization in digital marketing strategies across different contexts.","This systematic literature review compares AI adoption in digital marketing between developed and developing countries, highlighting differences in infrastructure, human resources, and policy support, and providing recommendations for policymakers and practitioners to optimize AI utilization."
"Artificial intelligence in marketing: Innovations that are shaping the future of advertising industry","https://scispace.com/papers/artificial-intelligence-in-marketing-innovations-that-are-4v197j234vp5","2024","Journal Article","Kultura","Miloš Stojanović
Marija Milojić-Stanojević
Vladan Madić","10.5937/kultura2484125s","","No","","This paper addresses applications and innovations that artificial intelligence (AI) as a technology provides to several segments of marketing, with an emphasis on the Republic of Serbia. The work is founded on the reality that artificial intelligence is drastically changing the way businesses engage with customers, collect and analyse data and develop individualized marketing tactics. Marketing gurus who do not use artificial intelligence in their work face far more challenges than their counterparts who do. As a result, the paper emphasizes the benefits of adopting artificial intelligence for consumer and competitor data analysis, user experience customisation, and marketing campaign optimization. The data collected in interviews with advertising industry specialists served as a foundation for the qualitative research. The findings of this article demonstrate that artificial intelligence, as an innovation, has enormous potential to transform the future and benefit the advertising sector.","This paper explores AI's applications in marketing, emphasizing its impact on customer engagement, data analysis, and personalized marketing tactics in the Serbian market, highlighting its benefits for data analysis, user experience, and marketing campaign optimization."
"Artificial intelligence and marketing strategies. A bibliometric perspective","https://scispace.com/papers/artificial-intelligence-and-marketing-strategies-a-35bmpvpx2juv","2024","Journal Article","","Cristiana Nuță","10.24818/mswp.2024.07","","No","","In a context of digital transformation, the integration of new technologies has become essential for companies. The interdependence between artificial intelligence (AI) and marketing strategies (MS) is recognized as revolutionizing the way companies interact with customers and achieve results. Therefore, the purpose of this paper is to explore the synergy between AI and MS by conducting a bibliometric analysis in order to highlight the current structure of studies and future research direction in this field. The research included a bibliometric analysis of 134 articles retrieved from the Web of Science (WOS) database. The scientific content of these articles was analysed in the VOSviewer software program, considering descriptive analysis and conceptual and social scientific mapping. The results included a quantitative analysis of the main categories of publications, their evolution over time, including by country, as well as analyses of term co-occurrence and co-authorship. The main countries according to the number of annual publications are the United States of America, England, China, India, Australia, and the main field covered, according to WOS references, is the field of ""Business"". As a result, the research confirmed the significant interdependence between AI and MS, as well as its complexity and especially its implications for organizations. In this regard, the need for future collaborative and interdisciplinary approaches is noted, with the bibliometric analysis provided in this paper as a starting point for future research directions.","This study explores the synergy between artificial intelligence and marketing strategies through a bibliometric analysis of 134 articles, highlighting the current structure of studies and future research directions in the field of AI and MS integration."
"Artificial intelligence in marketing: modern trends and development prospects","https://scispace.com/papers/artificial-intelligence-in-marketing-modern-trends-and-5b742k9crz","2024","Journal Article","Nauka, tehnologìï, ìnnovacìï","T. Tardaskina","10.35668/2520-6524-2024-2-06","","No","","The publication examines the influence of artificial intelligence on the marketing activities of digital economy enterprises. Artificial intelligence, with its ability to efficiently analyze large amounts of data, identify trends and make accurate predictions, is becoming an integral component for developing and implementing successful marketing strategies. Using artificial intelligence in marketing allows businesses to optimize their strategies, improve customer interactions, and improve the effectiveness of advertising campaigns. The main areas of use of artificial intelligence include data analysis, content personalization, the use of chat-bots and automated interaction with customers, analytics and forecasting, optimization and personalization of advertising campaigns, social network analysis and email marketing. The analyzed areas of use of artificial intelligence allow enterprises to create personalized marketing strategies, effectively use data and automate processes, which leads to increased competitiveness and successful adaptation to the requirements of the digital era. Artificial intelligence tools are proposed that are advisable for marketers to use for creating text, creating images, editing video and audio, for analytics and SEO optimization. AI tools will help marketers make better use of data, automate processes, and make consistent decisions in shaping and improving marketing strategies. Artificial Intelligence has the potential to revolutionize marketing activities by making them more effective, personalized and emotionally engaged, so it is important for businesses to be prepared to use AI tools to their full potential.","The publication examines the influence of artificial intelligence on the marketing activities of digital economy enterprises and proposes artificial intelligence tools that are advisable for marketers to use for creating text, creating images, editing video and audio, for analytics and SEO optimization."
"Marketing Strategy Metamorphosis Under the Impact of Artificial Intelligence Services","https://scispace.com/papers/marketing-strategy-metamorphosis-under-the-impact-of-ama3g95nzq23","2025","Journal Article","Systems","Adrian Stancu
Mirela Panait","10.3390/systems13040227","","No","","Companies’ marketing decision-making effectiveness depends on the quality of actions and time. In the current digital era, any marketing decision making must be timely in response to customers’ feedback, and implementing artificial intelligence (AI) technology is one significant option. This paper focuses on designing an Algorithm for Marketing Strategy Decision Making (AMSDM) that employs AI services to process online feedback from customers regarding products and services from companies’ websites or other e-commerce and social media platforms. For this research, 1200 texts containing customer feedback were analyzed by Azure Text Analytics service, which identifies the types of customers’ online feedback, domains, subdomains, and keywords it refers to and understands the emotional tone and attitudes conveyed in customer responses through sentiment analysis techniques. The model performance was underlined by computing the Accuracy, Precision, Recall, and F1-Score metrics for both short and long phrases feedback. Furthermore, Azure Text Analytics was integrated into a C# script to extract the frequency of occurrence of domains, subdomains, and keywords. After that, the process of AMSDM and its advantages were detailed. The AMSDM eliminates the necessity for manual intervention and conserves both time and resources. Moreover, the real-time nature of the analysis allows companies to respond promptly to changing market dynamics and customer preferences.","This study designs an Algorithm for Marketing Strategy Decision Making (AMSDM) using AI services to analyze customer feedback from online platforms, enhancing marketing decision-making effectiveness by providing timely insights and eliminating manual intervention."
"The Role of Artificial Intelligence in Marketing Analytics","https://scispace.com/papers/the-role-of-artificial-intelligence-in-marketing-analytics-3xy3xoxzf9","2023","Journal Article","International Journal For Multidisciplinary Research","Zhang Nan
Zhao Kun
Zhao Chen","10.36948/ijfmr.2023.v05i04.4956","","No","","The marketing sector is undergoing a transformation thanks to artificial intelligence (AI), which offers companies previously unheard-of insights into consumer behaviour and preferences. The future of artificial intelligence in marketing analytics is bright, with increased personalization, integration with other technologies, and a greater emphasis on ethical and responsible AI. Businesses should invest in AI expertise, give ethical and responsible AI top priority, concentrate on customer privacy and data protection, embrace new technologies, and work with AI suppliers and start-ups in order to fully use the power of AI. Businesses can use this to stay one step ahead of the competition, foster future growth, and achieve success","The marketing sector is undergoing a transformation thanks to artificial intelligence, which offers companies previously unheard-of insights into consumer behaviour and preferences, and businesses should invest in AI expertise, give ethical and responsible AI top priority, concentrate on customer privacy and data protection, and embrace new technologies."
"Exploring Machine Learning’s Impact on Digital Marketing","https://scispace.com/papers/exploring-machine-learnings-impact-on-digital-marketing-ts0h6sbvtoid","2024","Journal Article","","Mamta Kumari
Raj Sinha
Prosanta Chakrabarty
Mohammed K. Hasnain
Neshat Qamar
Sandeep Gupta","10.1109/icccnt61001.2024.10724818","","No","","This survey paper investigates the profound influence of machine learning (ML) on reshaping digital marketing strategies and practices. As ML technologies evolve rapidly, they are revolutionizing how marketers understand, engage with, and convert consumers. The paper comprehensively analyzes the key ML algorithms and their applications in the digital marketing landscape, including predictive analytics, personalized recommendation systems, sentiment analysis, and customer segmentation. It explores how ML-driven approaches empower marketers with actionable insights, enhance customer experiences, and drive business growth. Additionally, the paper discusses emerging trends, challenges, and future directions in the integration of ML with digital marketing strategies, highlighting the importance of ethical considerations, privacy protection, and ongoing innovation to harness the full potential of ML in shaping the future of marketing.","This survey paper explores the impact of machine learning on digital marketing, analyzing key algorithms and applications, and discussing emerging trends, challenges, and future directions, highlighting the importance of ethics, privacy, and innovation in harnessing ML's potential for business growth and customer experience enhancement."
"The Impacts of Big Data Analytics and Artificial Intelligence on Marketing Strategies","https://scispace.com/papers/the-impacts-of-big-data-analytics-and-artificial-5kwmnji1qdqj","2025","Journal Article","Global journal of economic and finance research.","Luther Kington Nwobodo","10.55677/gjefr/05-2025-vol02e1","","No","","The marketing sector has seen a significant transformation, particularly due to the emergence of data-driven decision-making and the dominance of digital platforms. This transition signifies a deviation from traditional marketing strategies, which formerly depended on more direct contact methods and conventional market research techniques. As digital technologies have grown, they have changed how we can track and change customers' buying habits and given us new ways to connect with them. Digital platforms and enhanced data provide marketers new consumer insights, making marketing more challenging. A detailed literature review and practical assessment analyse the real and prospective benefits of big data analytics and artificial intelligence on marketing decision-making. According to the paper, AI and big data analytics may assist companies understand customer and industry developments. They might then modify their marketing for each user. Big data analytics and AI improve target market positioning, simplify marketing, and educate consumers, affecting marketing strategy. The research suggests creating a data analysis team, streamlining data gathering and combination, using adaptable analytical tools, and customising marketing efforts. Some issues remain with this research. Data reliability and group size matter. The steps are unclear. For more solid and unambiguous results, future study should examine the impact of marketing using AI and big data analytics, maybe on a particular sector. This research may assist firms greatly enhance their marketing.","This study examines the impact of big data analytics and artificial intelligence on marketing strategies, revealing benefits such as improved target market positioning, simplified marketing, and enhanced customer understanding, but also highlights challenges and limitations."
"Impact of Artificial Intelligence in Companies Marketing Strategies","https://scispace.com/papers/impact-of-artificial-intelligence-in-companies-marketing-272g01k2ox","2024","Journal Article","Indian Scientific Journal Of Research In Engineering And Management","Anil K. Jaiswal","10.55041/ijsrem32762","","No","","In today's digitally driven marketplace, personalized marketing has emerged as a pivotal strategy for businesses aiming to engage customers on a deeper level and foster long-term relationships. With the advent of Artificial Intelligence (AI), personalized marketing has reached unprecedented levels of customization and effectiveness. This master's thesis delves into the intricate relationship between AI and personalized marketing strategies, focusing on how AI-powered techniques can revolutionize customer engagement and satisfaction. The research explores various facets of personalized marketing, including data collection, analysis, and implementation of tailored campaigns. Through a comprehensive literature review, this thesis examines the theoretical underpinnings of personalized marketing and the evolution of AI technologies in this domain. Moreover, empirical studies and case analyses are conducted to illustrate real-world applications and outcomes of AI-driven personalized marketing strategies across diverse industries. Key themes investigated include the role of machine learning algorithms in deciphering consumer behavior patterns, the ethical considerations surrounding data privacy and consent, and the implications of AI-generated content on brand-consumer interactions.","AI-powered personalized marketing revolutionizes customer engagement and satisfaction by enabling data-driven insights, tailored campaigns, and enhanced customer experiences."
"AI Washing in Marketing","https://scispace.com/papers/ai-washing-in-marketing-g00pt37zcfx0","2025","Journal Article","Advances in computational intelligence and robotics book series","Anu C. Haridasan
Naveenraj Xavier
Mayuram S. Krishnan
G. Glorindal","10.4018/979-8-3373-3897-2.ch015","","No","","Artificial Intelligence in marketing has revolutionized business-consumer engagement, offering unprecedented opportunities for personalization and innovation. However, alongside these advancements, the practice of “AI washing”—the deliberate misrepresentation of AI capabilities for competitive advantage has emerged, misleading consumers and undermining trust in legitimate AI-driven innovations. This research traces AI marketing's evolution from basic data-driven approaches to predictive analytics, exploring how industry hype fuels deceptive practices. It evaluates the feasibility of AI implementation, the long-term viability of AI-driven marketing strategies, and the ethical considerations necessary to balance innovation with transparency. Through case studies and an analysis of marketing agencies' role in AI washing, this research identifies key risks, including reputational damage, legal liability. It also highlights tensions between marketing claims and actual AI capabilities. By addressing these concerns, this study contributes to the broader discourse on ethical AI marketing.","This research explores the emergence of ""AI washing"" in marketing, where companies misrepresent AI capabilities for competitive advantage, and evaluates the feasibility, viability, and ethics of AI-driven marketing strategies, highlighting key risks and tensions between marketing claims and actual AI capabilities."
"Adapting digital marketing to artificial intelligence","https://scispace.com/papers/adapting-digital-marketing-to-artificial-intelligence-3ac362hvb1","2023","Journal Article","Ekonomìčnij vìsnik Dnìprovsʹkoï polìtehnìki","Mshvidobadze T. I
Osadze L. T
S. O.","10.33271/ebdut/84.122","","No","","Methods. In recent years, marketing has reached a point of evolution where adapting to digital trends is essential. In many situations, the platforms used for online promotion include algorithms to identify the best combinations. Specific research methods were used: analysis and synthesis - when identifying new trends in digital marketing, in particular, the use of keywords for sustainable business; classifications – for grouping the most common keyword research tools in digital marketing. Results. The article provides research that highlights the current position of digital marketing. It has been demonstrated that a new sub-industry is actively growing in the modern marketing industry – automated marketing, which is characterized, among other things, by the inclusion of voice search in marketing or keyword identification methods. and the inclusion of voice search in marketing or keyword identification methods. The most common keyword research tools in digital marketing are identified, the effectiveness of their application in the practical activities of a marketer is shown. The results of the authors in this article show a change from digital marketing to intelligent marketing using artificial intelligence. Novelty. Modern trends in the development of digital marketing are identified, and the specifics of its new form – Intellectual marketing – are highlighted. Features of adapting the modern marketing model to artificial intelligence are demonstrated. Practical value. The paper reviews the current state of artificial intelligence in marketing processes and provides a consistent model using an intelligent marketing solution that can improve website visibility through keywords.","The article highlights the growing trend of AI-powered digital marketing and its impact on the industry. It identifies the key tools and methods used in this field and demonstrates the shift from digital marketing to intelligent marketing."
"The Influence of Digital Marketing on Business Performance","https://scispace.com/papers/the-influence-of-digital-marketing-on-business-performance-18514lz037","2024","Journal Article","Advances in marketing, customer relationship management, and e-services book series","Ali Tazi Cherti","10.4018/979-8-3693-3172-9.ch012","","No","","This research examines the impact of digital marketing (DM), through the integration of artificial intelligence (AI), on business performance (BP) in the Moroccan context. Utilizing a structured questionnaire and the advanced PLS-SEM method for analysis, it uncovers a strong positive correlation between the use of AI in DM and improved BP. This relationship signifies a paradigm shift towards more personalized marketing strategies, data-driven decision-making, and dynamic adaptation to market trends. The research highlights how AI not only enhances operational efficiency but also fosters innovation and value creation, urging Moroccan companies to rethink their digital strategies. It emphasizes AI's pivotal role in transforming the digital marketing landscape, suggesting that its strategic integration is essential for companies aiming to thrive in the digital era. The study's uniqueness stems from its focus on Morocco, offering insights into the adaptation of AI in DM within an African context, thereby contributing to the understanding of digitalization in emerging economies.","This study examines the impact of AI-integrated digital marketing on business performance in Morocco, revealing a strong positive correlation and highlighting AI's role in fostering innovation, value creation, and operational efficiency in emerging economies."
